tweet,date,time,favorites,retweets,tweetID,hashtags,ats
second rt wishing happy birthday mille bisous ,2010-11-24,16:59:26,44,124,6551,[],"['JungleJulia', 'willholloway']"
touche touche rt biba living legend think applying lashes onto lashes touche say ,2010-11-24,14:06:28,51,129,6552,[],"['todddln', 'katyperry']"
inspiring clip mentor ,2010-11-24,11:49:10,16,66,6553,[],['todddln']
movie catfish blow mind ca sleep ,2010-11-24,02:42:01,112,340,6554,['pleasepaintmyportraitangela'],[]
bought rt debut album pink friday stores ,2010-11-23,15:41:27,1515,2247,6555,[],['NICKIMINAJ']
someone goat-stration ,2010-11-23,15:29:38,14,58,6556,[],['OhFerras']
rt heart goes friends loved ones korea tense time ,2010-11-23,14:30:02,69,433,6557,['PRAYFORKOREA'],['ITSJEREMYSCOTT']
amazing three row teenage dream happy rt firework itunes gogogo ,2010-11-23,00:58:31,212,531,6558,['1'],"['Geli', 'katyperry']"
toasty bunz rt love seat warmers car ,2010-11-23,00:24:32,43,99,6559,[],['RickHenryLA']
real life angels singing firework might need tissue sweet ,2010-11-22,21:13:14,211,505,6560,[],[]
gurl hair looked amazeballs ,2010-11-21,23:03:59,1331,3166,6561,[],['taylorswift13']
u ,2010-11-21,22:08:42,266,967,6562,[],['Pink']
way red carpet pink today ,2010-11-21,17:24:45,144,549,6563,['AMA'],[]
rt scramblin life together asap u help w/clothes/toothpaste/life hit w/a tweet thanksss ,2010-11-21,14:26:28,35,113,6564,[],['skeetonmytwitts']
rt la pplz 1 bestfriends house burn last night lost everything 2go tour 2 days ,2010-11-21,14:25:30,40,102,6565,[],"['skeetonmytwitts', 'CoryEnemy']"
amen rt god glory ,2010-11-21,10:53:29,544,1095,6566,[],['NICKIMINAJ']
telescope lesson ,2010-11-20,22:51:56,121,263,6567,['geekchic'],[]
miss ginger head ,2010-11-20,20:31:48,47,79,6568,[],['BonnieMcKeee']
cause youuuuuu famous rt fame quiz guess gave sweaty hug ,2010-11-20,20:13:11,46,130,6569,[],['JoJoWright']
met one time favorite artists tonight magical mark ryden ,2010-11-20,01:50:09,159,252,6570,[],[]
ca wait rt returned rehearsals amas put ummm f.i.e.r.c.e ,2010-11-19,20:29:51,56,168,6571,['firework'],"['Geli', 'katyperry']"
folks ,2010-11-19,18:15:41,258,1127,6572,[],[]
handlers someone offices gossipmonger thought could use little extra press planting story ,2010-11-19,18:12:49,59,138,6573,[],['VH1']
silly press check one asked vh1 tone digitalized image poster particularly size chest ,2010-11-19,18:09:05,95,238,6574,[],[]
finished ama rehearsal excited remix performance going mixture adorable gorgeous ,2010-11-18,23:43:59,113,429,6575,['AMA'],[]
u missed event nyc week miss holidays u rt ,2010-11-18,14:06:29,64,253,6576,['PURR'],[]
lotsa cats though disco might happy miss ,2010-11-18,13:52:48,9,40,6577,[],['ItsBennyBlanco']
congratulations amen ,2010-11-17,18:41:48,94,401,6578,['yourwish'],['Pink']
two funniest men alive one television screen tonight miss mr. tonight tbs ,2010-11-17,10:26:10,80,280,6579,[],"['rustyrockets', 'ConanoBrien']"
congrats ho i'ma picking today lover bear c ,2010-11-16,20:13:12,541,1112,6580,['LOUD'],['rihanna']
amazing story love mom rt hey kp watch balled eyes deserving ,2010-11-16,16:11:01,97,218,6581,['Firework'],['PerezHilton']
still ustream launch check www.katyperrybeauty.com ,2010-11-16,12:46:50,52,251,6582,['PURR'],[]
greeley square another 45 minutes come hang cut line ,2010-11-16,12:21:18,33,133,6583,['purr'],[]
watching www.katyperrybeauty.com ,2010-11-16,11:41:06,71,294,6584,['purr'],[]
step milk truck meow rt purr milk truck ,2010-11-16,09:42:20,67,145,6585,[],"['DarrenBaber', 'katyperry']"
please allow introduce latest kitty addition family name ,2010-11-16,09:33:14,154,401,6586,['Purr'],[]
way rain ca check person check online 20mins katyperrybeauty.com rt ,2010-11-16,09:27:30,39,230,6587,['PURR'],[]
parade launch greeley square nyc check www.katyperry.com details see meow ,2010-11-16,08:04:01,51,173,6588,['PURR'],['11am']
morning ca make event location nyc announcing 10am u catch ustream 11:30 ,2010-11-16,07:11:34,38,157,6589,[],['11am']
nyc alert tomorrow morning 10am tweeting location parade signing tomorrow 11am miss ,2010-11-15,19:11:33,50,256,6590,['PURR'],[]
eating food mean ,2010-11-15,15:11:06,39,75,6591,[],['BonnieMcKeee']
,2010-11-15,14:03:26,59,156,6592,['seenit'],['keshasuxx']
thanx awesome card ,2010-11-14,16:17:11,41,106,6593,[],"['marmitecrackers', 'thehappyapple']"
oh gosh saw itunes take number 1 double dog dare let make spark burst ,2010-11-14,16:06:34,523,1097,6594,"['FIREWORK', '2']",[]
thank ,2010-11-14,11:35:57,435,900,6595,[],[]
omg kids loud radio 1 teen awards loudest think 've ever heard gon na b amazin t.swift ,2010-11-14,07:06:22,226,551,6596,"['LONDON', 'FUNDON']",[]
listening christmas music photo shoot today early ,2010-11-13,07:56:30,109,389,6597,['christmascomesealryinLDN'],[]
agreed drive santa barbara trick rt best way check mix car driving ,2010-11-13,07:22:02,68,146,6598,[],['YELLEtweets']
rt chick elbowed homegirl dougie'n gave nosebleed ,2010-11-13,06:13:07,37,138,6599,"['totesmega', 'meggggga']",['skeetonmytwitts']
amen rt oh usa ok dismember woman prime time tv ample cleavage living breathing woman ,2010-11-13,05:38:08,94,375,6600,[],['DitaVonTeese']
launch purrfect cat nap ready paul o'grady tonight ,2010-11-12,13:49:34,62,191,6601,"['PURR', 'werkinggurl']",['Selfridges']
attention americans cute little fingers ready voting ends today u power vote ,2010-11-12,11:17:28,46,262,6602,['AMA'],[]
need cat nap ,2010-11-12,11:07:55,332,935,6603,['purrrrrrr'],[]
true werkin weekend rt ,2010-11-12,11:06:49,28,71,6604,['TGIF'],['karlihenriquez']
london ,2010-11-12,07:04:53,75,211,6605,[],['SELFRIDGES']
aw miss rt today built beer castle max martin ,2010-11-12,04:06:30,42,103,6606,['Normal'],['BonnieMcKeee']
ferras alien goat rt show ancient aliens thoughts aliens ,2010-11-12,04:02:59,27,80,6607,[],"['MDMOLINARI', 'Historychannel']"
thanks ,2010-11-12,03:59:11,10,39,6608,[],['PerezHilton']
girl got ta werk ,2010-11-11,14:52:25,19,64,6609,[],['PerezHilton']
attention londonites debuting new fragrance tomorrow selfridges :00pm cat meow ,2010-11-11,14:46:47,100,429,6610,['PURR'],['2']
first time 've heard radio ktu go go go ,2010-11-10,23:45:19,284,595,6611,['FIREWORK'],[]
nyc ,2010-11-10,23:27:20,399,1504,6612,[],[]
backstage victoria secret fashion show bet y'all love twit pics today ladies r jaw dropping ,2010-11-10,13:21:13,192,404,6613,['VSFashionShow'],[]
hbdy esterday ,2010-11-10,07:16:39,20,44,6614,[],['Geli']
ha rt practically fucking pint ben jerry oatmeal cookie ice cream right omg romantic comedies real ,2010-11-10,07:14:58,86,153,6615,[],['SarahKSilverman']
yaaaaay going make ring tone rt glee version teenage dream itunes weeeeeee ,2010-11-10,07:12:49,244,683,6616,"['1', 'cute']","['Geli', 'katyperry']"
look getting curious around london town purrrrrrrrr ,2010-11-09,09:38:46,161,362,6617,[],[]
nice seeing og katycats tonight ca wait hang real style x0 ,2010-11-08,23:17:06,175,322,6618,['californiadreamstour'],[]
sprinkle nails anyone yum ,2010-11-08,22:48:29,312,643,6619,[],[]
wanted say thank wonderful people voted last night ema ,2010-11-08,04:17:00,182,656,6620,['WERULE'],[]
yep gave shout ya yay rt juss heard n best vid emas good lookn europe chuuch ,2010-11-07,15:52:37,109,452,6621,[],"['SnoopDogg', 'katyperry']"
u better werk madrid heading back watch show full costume change course know beat record 12 last year ,2010-11-07,13:15:50,137,654,6622,['EMA'],[]
oh really 'tpissmeoff ,2010-11-07,07:03:51,150,200,6623,['iholdthekeytotheyouknowwhatdon'],['rustyrockets']
today day show y'all ,2010-11-07,02:41:15,361,773,6624,[],[]
lol rt admit 've cried everclear father mine ,2010-11-07,02:05:05,43,110,6625,[],['skeetonmytwitts']
yay pmore madrid gogogogogo ,2010-11-07,02:04:00,273,710,6626,[],['yelyahwilliams']
baaaack hello madrid ,2010-11-06,01:36:17,273,848,6627,[],[]
oh gosh brought sweet tear eye teenage dream glee makes heart go weeeee ,2010-11-05,13:09:03,1118,3147,6628,[],[]
aussies kiwis r awesome awesome 've expanded adding two dates click www.katyperry.com ,2010-11-04,02:49:38,126,430,6629,['CALIFORNIADREAMSTOUR'],[]
agree loved baby calf getting milked amazing rt inspired today love dave meyers bestest ,2010-11-04,00:14:26,42,121,6630,[],['Pink']
congrats rt happy healthy baby girl monday mum baby great ,2010-11-03,14:44:32,35,123,6631,[],['greg_wells']
bazaar lovely rt covers dec 2010 sparkles cover harper ,2010-11-03,13:19:30,35,136,6632,[],"['JustJared', 'harpersbazaarus', 'KatyPerry']"
gave chills rt gon na night like forth july coming parents ,2010-11-03,03:40:10,154,321,6633,['FireWork'],"['MonsterLexxyy', 'katyperry']"
true rt bitten love bug ,2010-11-03,02:59:43,40,113,6634,[],"['TheSamFrance', 'katyperry']"
've bitten spider file 1 ever growing cabinet false information peak late ,2010-11-03,02:25:55,125,294,6635,[],[]
voting ema ends tomorrow 've nominated 5 awards cool see u madrid surprise ,2010-11-03,01:44:56,75,360,6636,[],[]
video proud avail itunes heard entered top 10 happy thnku ,2010-11-02,14:15:39,195,601,6637,['FIREWORK'],[]
hot bff betches rt gir know werqed ..with lol ,2010-11-02,03:35:57,75,119,6638,[],"['RidingOnDMetro', 'JaMaalBuster', 'katyperry']"
sister rt watching sisters keeper ca stop crying ,2010-11-02,03:33:34,40,77,6639,[],"['MDMOLINARI', 'miamoretti']"
rt praying lily ,2010-11-02,03:28:54,47,346,6640,[],['JungleJulia']
hey playin goat ban rt dec 5th much fun let go ,2010-11-01,13:04:21,41,114,6641,['JingleBall2010'],"['karlihenriquez', 'OhFerras']"
u rt costume ,2010-11-01,09:26:09,22,74,6642,[],['taylorrainboww']
werk rt rockin costume favorite shooting star xo ,2010-11-01,09:23:06,88,103,6643,[],"['lollyjean', 'katyperry']"
a-may-zing rt costume ohlala ,2010-11-01,02:43:17,77,121,6644,[],"['kir3sty', 'katyperry']"
werk wig gurl rt ,2010-11-01,02:35:20,63,109,6645,['OnlyGirlInTheWorld'],['karlihenriquez']
whore-a-ween def fav heard spirit rt missing today favorite holiday love boo ,2010-11-01,02:18:02,87,128,6646,[],"['MDMOLINARI', 'katyperry']"
told woman obsessive nails replied woman think seen kitty oompa russell nails ,2010-10-31,08:16:17,334,728,6647,[],[]
witch witch witch ,2010-10-30,12:17:45,16,62,6648,[],['OhFerras']
sexy rt everyone look uncomfortable katy perry  teenage dream  ring tone goes ,2010-10-29,23:12:53,180,386,6649,[],['ConanOBrien']
true rt whole family gets go london meet katy holy cow katy perry 'firework contest ,2010-10-29,23:07:43,58,114,6650,[],['Geli']
word street costume halloween thing say please fail send pix ,2010-10-29,09:47:37,269,742,6651,[],[]
thanks beautiful feedback gon na sing along ema hope ,2010-10-28,23:41:29,119,498,6652,['FIREWORK'],[]
proud present glowing glory u spark ignite light ,2010-10-28,16:32:17,348,1509,6653,['FIREWORK'],[]
rt life grandmother raised taught everything life one extraordinary woman ,2010-10-28,10:57:43,88,278,6654,['FIREWORK'],['EMTChica21']
coming soon update soon meanwhile let put trending topics tell means u ,2010-10-28,01:47:59,98,576,6655,['FIREWORK'],[]
officially dedicating new video everyone spark firework ,2010-10-28,01:37:17,74,398,6656,['itgetsbetter'],['PerezHilton']
ready see 've got proud present ,2010-10-28,01:22:52,178,766,6657,['FIREWORK'],[]
thank birthday messages beaming love light ,2010-10-25,13:50:27,1036,1963,6658,[],[]
,2010-10-24,14:55:34,491,1282,6659,[],[]
twit break greatest gift u give us respect private x. use wasting ur x w/ stolen false info thnku ,2010-10-19,15:03:19,203,641,6660,[],[]
something say ,2010-10-19,14:54:47,802,989,6661,[],[]
uk friends could tix/sold added two extra final shows liverpool ldn www.katyperry.com tix sale fri ,2010-10-19,11:22:52,78,281,6662,[],[]
life theme breakin necks come tour ,2010-10-19,10:41:46,18,44,6663,[],['mdmolinari']
mtv ema coming performing also 've nominated 5 awards omg vote/rt ,2010-10-19,07:40:12,106,737,6664,[],[]
finally saw social network genius ,2010-10-18,12:33:16,232,620,6665,[],[]
oh gawd nervous thanks making feel like actually one contestants ,2010-10-17,14:20:01,180,673,6666,['xfactor'],[]
excited todays look could barf whole michaels craft store ,2010-10-17,09:07:42,116,313,6667,"['xfactor', 'johnnywujek']",[]
knew brave enough rt peacock going quite well da gay club ha ,2010-10-17,08:17:42,165,403,6668,[],"['PerezHilton', 'katyperry']"
day show y'all ,2010-10-17,08:17:08,221,462,6669,[],[]
confused ,2010-10-16,14:15:19,144,682,6670,"['wagner', 'xfactor']",[]
rebecca ferguson rad nice style ,2010-10-16,13:55:41,86,626,6671,['xfactor'],[]
crap diva fever totally stole outfit tomorrow performance ,2010-10-16,13:45:58,135,797,6672,"['xfactor', 'barbarastreisand']",[]
better entertainment mom dancing incredible moves come amazing ,2010-10-16,10:49:36,297,705,6673,[],[]
rt booky wook 3 time yes dear ,2010-10-16,08:46:29,86,168,6674,[],['rustyrockets']
check teaser new music video firework ca wait present whole thing soon click ,2010-10-15,22:00:13,301,870,6675,[],[]
p.s tickets became avail today select spots sale tomorrow uk dates www.katyperry.com yay ,2010-10-15,16:43:53,62,222,6676,['THECALIFORNIADREAMSTOUR'],[]
finished rehearsals sundays x factor excited song way going brighter moon ,2010-10-15,16:38:40,86,487,6677,['xfactor'],[]
childrens menu always looks delicious damn kids ,2010-10-15,10:44:35,1585,4271,6678,[],[]
today best day ,2010-10-14,22:32:38,677,1634,6679,[],[]
totes want rt nicki need song together ,2010-10-14,13:07:19,697,1077,6680,['Fierceness'],"['PerezHilton', 'katyperry']"
want mickey mouse shaped pancakes ,2010-10-14,12:50:21,455,1737,6681,[],[]
stoked announce performing troops divas salute troops dec 5 w/nicki minaj paramore ,2010-10-14,11:49:25,165,475,6682,[],['VH1']
glove tip lace nails anyone ,2010-10-13,16:49:12,196,342,6683,[],[]
twerking today man yutsai ,2010-10-13,14:30:47,86,164,6684,[],[]
long ass day hustler baby ,2010-10-13,02:36:29,373,838,6685,[],[]
yes rt ur teenage dream ,2010-10-13,02:32:50,998,2327,6686,[],"['rustyrockets', 'justinbieber', 'katyperry']"
ohhh emmm geee thank much rt rt huge congrats 3 ama nominations ,2010-10-12,14:06:39,52,230,6687,['TeenageDream'],"['Geli', 'CapitolRecords', 'KatyPerry']"
fer sure rt chickity china chinese chicken ,2010-10-12,10:21:57,273,1015,6688,[],['justinbieber']
whip hairs back n forth whip hairs back n forth ,2010-10-11,23:40:25,182,385,6689,[],[]
test icles rt test test ,2010-10-11,20:41:10,319,736,6690,[],['PerezHilton']
oh coming rt smell navel cheese need shower ,2010-10-11,19:04:14,50,120,6691,['justsayin'],['Geli']
shooting cover chic magazine today act like grown dang ,2010-10-11,16:17:12,150,251,6692,[],[]
p.s dates usa aus put soon course worry ,2010-10-11,02:49:37,147,364,6693,[],[]
california dreams tour kicks europe beyond check www.katyperry.com/news date ,2010-10-11,01:42:30,147,428,6694,[],[]
california dreams tour kicks europe beyond check www.katyperry.com/news date ,2010-10-11,01:16:17,153,383,6695,[],[]
tour announcement less 20 mins ,2010-10-11,00:42:08,423,813,6696,[],[]
done good welcome twitter rt ,2010-10-10,13:16:39,86,172,6697,[],['johnnywujek']
excited see tomorrow ,2010-10-10,02:53:17,1191,1924,6698,['katycats'],[]
every months hear bout us collab together press know interesting ,2010-10-09,14:13:44,12,52,6699,[],['stevemadden']
know lyrics fav song new record firework lyric vid w/sneak peak photo 2 help ,2010-10-09,12:23:36,112,377,6700,[],[]
new yorkers cali gurl performing z100 jingle ball madison square garden 12/10/10 check ,2010-10-08,19:44:48,79,259,6701,[],[]
heard 've practicing dance moves lately big dance give us tease pls ,2010-10-08,14:04:45,128,176,6702,['brsbw2'],['rustyrockets']
dear see one tweet signing books sperm sicko ,2010-10-08,08:16:59,197,277,6703,[],['rustyrockets']
tgif ,2010-10-08,07:27:15,835,3534,6704,[],[]
yes party ovah rt looked like rt vienna remember ,2010-10-07,04:37:28,58,116,6705,[],"['MDMOLINARI', 'ohferras', 'mdmolinari']"
caught ,2010-10-06,20:06:44,128,173,6706,[],['rustyrockets']
hey said asleep rt bed ,2010-10-06,20:03:34,284,399,6707,[],"['rustyrockets', 'katyperry']"
officially announce start tour monday oy hate secrets love surprises guess called ,2010-10-06,20:02:11,282,695,6708,[],[]
dancing like 13 year old girl w/ hairbrush mic song hang ,2010-10-06,19:48:30,249,383,6709,['turninghairbrushdreamsintorealities'],['robynkonichiwa']
thank vienna lovely chic crowd see next year ,2010-10-06,17:44:21,53,133,6710,[],[]
vienna remember ,2010-10-06,16:35:29,21,41,6711,[],"['ohferras', 'mdmoinari']"
drove statue vienna woman tits mustache/beard interesting ,2010-10-06,09:08:07,128,292,6712,"['moderneurope', 'alwaysevolving', 'markusmolinari']",[]
um never poland guys great tonight appoint best example great audience ,2010-10-05,16:49:07,341,864,6713,[],[]
happy birthday inventor word twerk twerk master ,2010-10-05,16:46:12,45,100,6714,[],['logandoesntweet']
wish could 've rt thats folks ,2010-10-05,08:14:37,43,82,6715,[],['jcdecastelbajac']
good afternoon warsaw lovely city never promise show good time ,2010-10-05,08:02:35,214,608,6716,[],[]
rt chanel ,2010-10-05,07:47:01,25,85,6717,[],['MDMOLINARI']
rt toooddaaaayyyyyy new ep la musique > > > ,2010-10-04,16:29:42,34,102,6718,[],['YELLEtweets']
still wan na see pic 13 ,2010-10-04,16:28:02,64,79,6719,"['90s', 'whatwerewethinking', 'Blondeshavemorefun']",['BonnieMcKeee']
really say rt see jessica stam got stamina ,2010-10-04,16:27:22,15,44,6720,"['major', 'lifechanginglyrics']","['logandoesntweet', 'kanyewest', 'Jess_Stam']"
happy birthday baby girl ,2010-10-02,10:59:13,27,103,6721,[],['Dani_Larios']
rt see weinerschnitzel lederhosen ,2010-10-02,08:54:50,138,318,6722,['oktoberfest'],['todddln']
starving lunch beer time bust wench dress god knows 've got rack ,2010-10-02,08:01:18,150,352,6723,['oktoberfest'],[]
thank budapestians helping mama groove back really like city tres romantic ,2010-10-01,17:05:15,136,351,6724,[],[]
u missed sunday check lil profile urs truly cbs ,2010-09-30,15:15:10,104,207,6725,[],[]
falling love budapest ,2010-09-30,12:33:11,233,585,6726,[],[]
rt day three vampire existence begins sleep day work night ,2010-09-30,11:14:49,38,102,6727,['Budapest'],['Geli']
rt read listen occupy senses whatever depraved way u choose ,2010-09-30,11:13:50,19,70,6728,['bookywook2'],"['rustyrockets', 'thedaylights']"
meant add link like dive wonderful wacky wild past dapper man mr. brand ,2010-09-30,01:23:57,53,111,6729,[],[]
congratulations new book today uk next book double dishes diapers hehehe ,2010-09-30,01:10:55,73,196,6730,['bookywook2'],['rustyrockets']
want thank magical people brought sparks video past days light reminded purpose ,2010-09-30,00:27:46,205,325,6731,[],[]
day two music video gon na stop shooting till sun comes cause light dark place ,2010-09-29,15:59:17,107,284,6732,[],[]
trust ur open chapter rt erotic literature time personal 2morrow ,2010-09-29,09:57:23,76,127,6733,['bookywook2'],['rustyrockets']
submit gas tank song pls hit kthnxbye ,2010-09-29,00:28:17,19,44,6734,[],['BonnieMcKeee']
6am wrap need recharge sparkle much tomorrow got ta show em worth make go ahhhh ,2010-09-28,22:18:52,136,225,6735,[],[]
another example falling victim deliciousness teenage dream repeat pls eat ,2010-09-28,14:29:50,170,444,6736,[],[]
start sparkling new music video ,2010-09-28,11:12:02,541,777,6737,[],[]
perfume rt cologne ,2010-09-28,08:19:34,72,161,6738,[],['skyferreira']
budapest bust ,2010-09-27,04:24:35,119,303,6739,[],[]
,2010-09-26,06:04:33,875,1927,6740,[],['rustyrockets']
dress rehearsal a-ma-zing time fer reeels p.s totes bff k. wiig ,2010-09-25,20:36:08,135,307,6741,['SNL'],[]
freeeeeeee rt free rt hey cheapskates raising hope free itunes ,2010-09-25,17:16:48,47,159,6742,[],"['karlihenriquez', 'shannonwoodward']"
dear kristen wiig lock hair put pillow touch go bed every night kthnxbye ,2010-09-25,16:45:17,589,801,6743,[],[]
trudy rt day like today requires nice healthy breakfast ,2010-09-25,11:15:40,40,137,6744,['MamaBear'],"['Geli', 'KatyPerry']"
wrapped rehearsals tuning tomorrow yayyyyyyy ,2010-09-25,01:04:26,41,128,6745,['SNL'],[]
prepping saturday night live-ness excited ohhhh myyyy gawwwwd favorite girls hallway ,2010-09-24,20:43:49,116,297,6746,[],[]
wow looks like play date elmo cut short still wan na play see www.katyperry.com tag elmo ,2010-09-23,10:25:43,307,831,6747,[],[]
've relocated ,2010-09-23,07:49:44,231,329,6748,[],[]
totally tell sesame street 've elmo hang proof ,2010-09-22,13:10:12,231,4,6749,[],[]
best friend shannon woodward new show raising hope premieres tonight f0x 9/8c funniest smartest woman know ,2010-09-21,12:47:29,84,252,6750,[],[]
waking ,2010-09-19,18:32:20,632,1180,6751,[],[]
whip hair back n forth ,2010-09-18,17:56:13,508,2072,6752,[],[]
signing liver transplant ,2010-09-18,15:56:43,298,801,6753,[],[]
cross line try put lens dress fianc job protect 'tfuckwiththebrands ,2010-09-17,19:06:03,648,2373,6754,"['standbyyourman', 'don']",[]
wish could good luck gon na wear soon rt love new york ,2010-09-15,13:31:55,63,189,6755,[],['ITSJEREMYSCOTT']
still serve warm soft chocolate chip cookies ,2010-09-14,15:44:47,165,291,6756,"['hungry', 'DOSPUEBLOS']",[]
time show school spirit ,2010-09-14,15:40:37,128,288,6757,['DOSPUEBLOS'],[]
gnight smell ocean gnight fond memories gnight taco stands gnight st. street gnight started ,2010-09-14,02:16:19,370,630,6758,['teenagedream'],[]
rt brought  biggest fan stage meet absolutely loved moment show ,2010-09-14,01:44:43,167,257,6759,[],"['TheEllenShow', 'KatyPerry']"
u best friend stitches last night highlarious say 1 best ev biased previous hosts ,2010-09-13,15:49:56,70,210,6760,[],['chelseahandler']
filming something speshul christmas today yep ahead game stores christmas season ,2010-09-13,14:40:21,107,231,6761,[],[]
gogogogogogo rt girl itunes today u let go ,2010-09-13,13:32:10,417,1022,6762,[],['rihanna']
awwwwwwwwww rt hosting awards win see wednesday la ,2010-09-12,22:44:00,203,316,6763,['RBMA'],"['rustyrockets', 'katyperry']"
sweet ride el ,2010-09-12,21:40:06,94,207,6764,[],[]
1 year anniversary love w/us spirit ,2010-09-12,20:15:32,324,832,6765,['VMA'],['rustyrockets']
wish could 've joined fun stayed bed 100 tomorrow watched madonna truth dare 1st time beyond inspired ,2010-09-12,01:28:56,170,323,6766,[],[]
nyc 2morrow wash sq park 100 dogs/cats breeds shelters across city need good homes ,2010-09-11,20:48:47,68,331,6767,[],[]
california girls mouth new york stronger beautiful ever /11 ,2010-09-11,20:00:29,311,1262,6768,['9'],[]
rt put 'no strings grindr profile want random sex bastard pinocchio broke heart ,2010-09-11,10:12:28,119,340,6769,[],['RealMattLucas']
exclusive behind scenes master planning california gurls music video ,2010-09-10,20:24:42,114,275,6770,[],['SnoopDogg']
everyone else enjoys enjoy flu-night-in ,2010-09-10,18:46:44,73,178,6771,"['FNO', 'FNI', 'ohwell', 'lookonthebrightside', 'saveabuckloseapound', 'makingupforitsunday']",[]
ever happened jonathan taylor thomas ,2010-09-10,02:12:04,191,1309,6772,['teenagedream'],[]
ur hands puss rt 've got kitty purry finally pussy like ha ,2010-09-10,01:39:48,124,210,6773,[],"['PerezHilton', 'KatyPerry']"
black olives butts smell like wellness formula pills yuck ,2010-09-10,00:10:42,113,260,6774,[],[]
knew gon na jammy jam rt whip hair back forth ,2010-09-09,21:32:07,67,118,6775,[],['skeetonmytwitts']
go go ,2010-09-08,20:20:08,55,290,6776,['stargate'],[]
rt cleaning lady daughter since 3pm say ,2010-09-08,20:13:15,39,78,6777,['slavelaborer'],['miamoretti']
bus drag queen loca ur new song girl winning far song bet kitten ,2010-09-08,20:11:50,421,850,6778,['1'],['rihanna']
leak info fer sure rt teenage dream song billboard hot 100 week ,2010-09-08,19:55:01,43,220,6779,['1'],"['ileaks', 'katyperry']"
2night fondue switzerland 1 best meals 've ever luv cheeese steve urkel style ,2010-09-08,19:54:22,112,192,6780,[],[]
time gon na find husband ,2010-09-08,11:24:02,19,55,6781,"['VMA', 'happyhusbandhunting']",['MDMOLINARI']
tell name put u n friends list beeotch looking replies ,2010-09-08,10:43:35,19,32,6782,[],['PopKornBitch']
caught ,2010-09-07,21:00:38,100,242,6783,[],[]
awwwwwwwww rt rt teenage dream seriously masterpiece u know ,2010-09-07,20:35:36,44,203,6784,[],"['MDMOLINARI', 'TarynManning']"
gurl movin play show ,2010-09-07,17:46:25,10,33,6785,[],['logandoesntweet']
okay big surprise opening season saturday night live sept 25 w/snl alum amy poehler click ,2010-09-07,15:50:03,118,496,6786,[],[]
dear amy poehler please braced faced neighbor friend hangs rickkkkk ,2010-09-07,15:47:52,85,237,6787,[],[]
okay big surprise opening season saturday night live september 25 w/snl alum amy poehler click ,2010-09-07,15:23:31,73,379,6788,[],[]
italy tonight show already started go later 've eaten everything sight tho feel like beached whale ,2010-09-07,13:21:01,116,409,6789,['xfactoritaly'],[]
yessssss rt think teddy needs interview kitty ,2010-09-07,12:19:27,36,100,6790,[],"['PerezHilton', 'katyperry']"
maybe kitty purry finally big break rt launched new website today rt ,2010-09-07,12:16:03,37,126,6791,[],['PerezHilton']
rt moment silence tupac shakur ,2010-09-07,11:58:29,55,868,6792,[],['SnoopDogg']
song jam rt rt listen rihanna new single girl world audio ,2010-09-07,05:56:31,161,536,6793,[],"['karlihenriquez', 'RSP']"
preach rt delicious ripe peach still people world hate peaches .. ,2010-09-07,02:01:34,193,566,6794,[],['DitaVonTeese']
cool aol check blonds fashion show live aol.com 16th link coming soon xoxo ,2010-09-07,02:00:43,25,40,6795,[],['phillipeblond']
question day whose tweets entertaining ,2010-09-07,01:49:44,126,327,6796,[],"['50cent', 'kanyewest']"
