tweet,date,time,favorites,retweets,tweetID,hashtags,ats
meow katycats tireless pca voting hold title favorite music fan following rule school ,2013-01-10,01:05:29,7249,11417,4352,[],[]
oh em gee showed pubes yeah songwriting ,2013-01-10,00:06:19,2734,4080,4353,[],['Siamusic']
got hiccups laughing hard cat video yer welcome ,2013-01-08,00:51:47,3675,5346,4354,[],[]
severely embarrassed discovered ikea monkey need together ,2013-01-04,23:57:08,4628,6315,4355,[],[]
happy new years everyone excited 13 safe party hard ,2012-12-31,21:02:48,9338,17596,4356,[],[]
caught rt may may signing hair brush right ,2012-12-29,18:48:51,1572,2684,4357,[],['ItsBennyBlanco']
switch rt im curious know p sy really tastes like pepsi cola ,2012-12-29,18:48:07,2325,4176,4358,[],"['OhFerras', 'LanaDelRey']"
santa ,2012-12-25,20:44:59,10870,11319,4359,[],[]
christmas question getting door tag santa new coal ,2012-12-25,14:01:55,3031,5614,4360,[],[]
,2012-12-10,11:13:54,18200,20069,4361,[],[]
dubai 've redefined word magic dictionary xo ,2012-12-09,15:39:29,3830,8515,4362,[],[]
happy 30th birthday angel warden sister angela love ,2012-12-07,14:03:16,4657,7139,4363,[],[]
best news hear getting 15 hour flight grammy nomination wide awake second best news hot shower ,2012-12-06,17:23:47,4958,6965,4364,[],[]
omg finally met amy grant nice ,2012-12-03,18:18:07,2967,4365,4365,[],[]
way watch red carpet live stream ,2012-12-02,19:57:46,1704,2921,4366,['TrevorLive'],[]
let use powers good lets trending gogogogogogo see brazil ,2012-11-27,12:34:20,3568,6891,4367,['happybirthdayyungskeeter'],[]
happiest birthday brother wants birthday big booty ho someone help brotha ,2012-11-27,12:26:12,2420,3563,4368,[],['yungskeeter']
hope everyone lovely tday thankful friends family welcoming kai group 1st ,2012-11-22,18:46:55,8494,7763,4369,[],[]
y'all tickled pink voted favorite female pop/rock artist thank ,2012-11-19,17:23:08,3562,6353,4370,['AMAs'],[]
've tweeting bout music lately decided make playlist favs lem know song u ,2012-11-14,17:14:53,2842,3860,4371,[],[]
think lil lady going massive discovered yet jump board jessie ware ,2012-11-10,00:57:24,1969,3438,4372,[],[]
finally turned faucet back flowing well well well ,2012-11-10,00:23:55,2051,4029,4373,[],[]
listening ladies since summer ca keep hiding u. haim welcome ,2012-11-08,23:05:30,1874,2797,4374,[],[]
hope prez got sleep today deserved ,2012-11-07,13:42:39,3362,5231,4375,[],[]
people power proud stand 4 years rt happened thank ,2012-11-06,22:11:53,4416,9577,4376,[],['BarackObama']
done dusted ,2012-11-06,21:23:53,3266,6687,4377,[],[]
proud exercise civic duty .twitter.com/juq67dfl ,2012-11-06,16:41:30,12143,9698,4378,['FORWARDpic'],[]
wow rt vote today brighter future brighter mean brighter voting lewk .twitter.com/tzkelrag ,2012-11-06,15:59:32,1223,1766,4379,['obamapic'],['JohnnyWujek']
may exclusively present might cutest photo ever taken gma potus happy voting tomorrow pic.twitter.com/9cdzmuil ,2012-11-05,23:00:06,11807,10078,4380,[],[]
ready vote tomorrow 've got outfit laid send photo outfit polls rt faves ,2012-11-05,14:26:40,1579,2740,4381,[],[]
've sent love light east coast time send warm meals shelter text red cross 90999 donate 10 ,2012-11-03,14:24:49,1671,3674,4382,[],[]
good things come threes next destination w/ milwaukee wi saturday free tix vote early ,2012-11-01,18:42:07,1410,2550,4383,[],['BarackObama']
like best friend ,2012-11-01,00:28:45,10481,8439,4384,[],['shannonwoodward']
feel honey rt like costume normal clothes ,2012-10-31,15:13:19,1725,2761,4385,[],['tavitulle']
check 91-year-old grandma polls early voting las vegas nv u got excuse pic.twitter.com/qesukpik ,2012-10-30,14:17:39,5480,4909,4386,[],[]
sending east coasters light love especially light ,2012-10-29,21:09:06,3447,6484,4387,[],[]
starting rationalize doomsday preppers *whistles particular rem song* ,2012-10-29,16:00:34,1486,2997,4388,[],[]
excited bring special performance dubai december 8th tickets ,2012-10-29,02:38:59,1386,2760,4389,[],[]
yeah rt make managers/lawyers fight haha ,2012-10-26,13:10:09,938,1775,4390,[],"['yungskeeter', 'devhynes']"
joke rt know without best friend ,2012-10-26,13:03:26,1135,2433,4391,[],['ImTracyMorgan']
thank making feel special today overwhelmed love might small happy cry blessed ,2012-10-26,02:20:25,5155,7711,4392,[],[]
bday complete lunch //twitpic.com/b7fm24 ,2012-10-25,22:50:56,10001,8549,4393,['chicvotehttp'],['MichelleObama']
omg rt dear twitter friends birthday requested donations lieu gifts ,2012-10-25,12:42:53,1172,2443,4394,[],"['DAVID_LYNCH', 'katyperry', 'LynchFoundation']"
thanks best friend rt happy 16th birthday love yooouuu good luck drivers test today ,2012-10-25,12:41:28,1839,3372,4395,[],"['shannonwoodward', 'katyperry']"
giggles rt never plastic bag always firework  happy birthday firework  ,2012-10-25,12:41:13,1072,2126,4396,[],"['sofifii', 'hellogiggles', 'katyperry']"
tonight great night president gave grandma unforgettable shout outs officially 28 best birthday ever ,2012-10-25,01:32:16,4926,8433,4397,[],[]
fired ready go ,2012-10-24,20:20:59,2414,5296,4398,[],[]
grandma ordered mac n cheese butter pecan gelato dinner ,2012-10-24,18:52:18,3116,3647,4399,"['91andgoingstrong', 'layoffhershewasstarving']",[]
vegas performing wednesday celebrate getting early vote free tix ,2012-10-22,21:55:32,1949,3459,4400,[],['BarackObama']
good rt janellshirtcliff ,2012-10-22,00:40:49,1305,1977,4401,[],"['amediumformat', 'SammyYBH']"
thanks darlin rt happy birthday lil mama ,2012-10-21,00:31:56,1737,2768,4402,[],"['frank_ocean', 'katyperry']"
transcendental meditation changed life birthday love pay forward lieu gifts donate ,2012-10-19,16:58:04,1852,3349,4403,[],[]
jodi firework ,2012-10-18,16:58:27,3199,5126,4404,['2MANYSTARS'],[]
never forget last night important moment thus far ,2012-10-14,17:19:24,3283,5211,4405,[],[]
wish auctioning sex assholes ,2012-10-13,12:28:27,6620,9931,4406,[],[]
u wanted rt news iphone wearing baby chee tiny hat thanks ,2012-10-10,22:18:52,2653,3486,4407,[],"['BonnieMcKee', 'katyperry']"
something brewing ,2012-10-09,21:19:57,6204,5763,4408,[],[]
sang president last night believe equal rights .twitter.com/r4kzbm9l ,2012-10-08,12:18:52,13671,14662,4409,"['ForAll', 'Votepic']",['BarackObama']
appropriate nails ,2012-10-07,16:39:49,16799,16501,4410,[],[]
today honored play president ,2012-10-07,15:10:45,4011,5238,4411,[],[]
oh em gee church soul cycle ,2012-10-06,15:13:53,1806,2769,4412,['feltthespirit'],[]
finally grow rt oy vey saturn returning sign 20 years whatevs good bad ,2012-10-06,04:42:36,1100,1978,4413,[],['MarthaPlimpton']
practicing euphemisms ,2012-10-04,23:38:37,488,897,4414,[],['BonnieMcKee']
beliebers ,2012-10-04,01:20:12,46438,93057,4415,[],[]
last night saw black keys tonight saw bieber think musical week complete ,2012-10-04,00:05:23,10220,23841,4416,[],[]
taking break singing joking around saw movie singing joking around perfect pitch perfect ,2012-10-03,17:41:35,4390,6255,4417,[],[]
om shanti shannon rt well asked minded put chanting music .and realized 100 ,2012-10-02,00:04:05,1187,2140,4418,[],"['shannonwoodward', 'katyperry']"
comes halloween comes halloween ,2012-10-01,16:19:55,4863,13340,4419,[],[]
ermagerd one day away pumpkin spice latte ,2012-09-30,15:53:24,541,907,4420,[],['sofifii']
putting freakum dress gon na go howl full moon ,2012-09-30,01:13:44,3180,5104,4421,[],[]
read note glad could prove family wrong ha xo ,2012-09-29,00:51:39,684,1089,4422,[],['touchmekaty']
japan thanks adorable love miss already left behind theaters ,2012-09-28,23:24:00,1859,3047,4423,['PARTOFME'],[]
kawaii rt cutest breakfast ever seen .twitter.com/jwbl10s9 ,2012-09-27,08:24:21,5471,8480,4424,['SLEEPYBEARpic'],['ITSJEREMYSCOTT']
miss yewww rt 40 mins til free hotel breakfast open u feeeel may ,2012-09-27,06:01:03,986,1718,4425,[],['yungskeeter']
katy dreams ,2012-09-26,11:16:19,4696,5221,4426,[],[]
thank whole year rt katy perry billboard woman year ,2012-09-26,07:49:36,2450,4905,4427,['WomeninMusic'],['billboard']
excited hang japanese fans tonight finally premiere movie part saved best last course  ,2012-09-24,23:09:08,2161,3826,4428,[],[]
better hand painted daria nails girls es nails tokyo ,2012-09-24,12:53:47,7007,6476,4429,[],[]
place like tokyo place like tokyo place like tokyo ,2012-09-24,03:45:38,3133,5732,4430,[],[]
vrooooom vroooooom ,2012-09-23,08:00:45,4279,5577,4431,[],[]
katycats time guys take home trophy vote biggest fans best female best pop ,2012-09-22,08:26:02,2042,4329,4432,['MTVEMA'],[]
spiritual ,2012-09-21,09:04:32,1220,2252,4433,[],[]
err something else rt kiss prince telaga tista water palace ,2012-09-21,04:32:58,1093,1728,4434,[],['MDMOLINARI']
hope 've bragged surviving jelly fish wrapping around body hope helps ,2012-09-21,02:50:33,450,822,4435,[],['onlyLeah']
werk middle rt rock boat ,2012-09-20,01:43:00,990,1905,4436,[],['Scott_Myrick']
ate prayed climbed volcano ,2012-09-18,21:10:44,11620,10064,4437,[],[]
today day take home even bigger dvd/bluray bonus footage songs jokes grandma ,2012-09-18,11:38:27,1647,3283,4438,['PartofMe'],[]
countdown help aids research alliance win 250k find cure aids vote ,2012-09-17,10:57:15,938,2116,4439,[],[]
getting shit chakra ,2012-09-17,04:29:44,1585,2827,4440,['eloquent'],[]
yaaaaaay rt martha plimpton emmy im glad ca stop yelling ,2012-09-15,21:50:43,1097,1900,4441,[],['shannonwoodward']
starting day group meditate ,2012-09-15,20:32:11,1238,2374,4442,['breakfastofchampions'],[]
rt bull pretty much shop gon na mess ,2012-09-15,20:30:45,823,1637,4443,[],['SarahKSilverman']
feel phoenix rising ,2012-09-15,00:25:03,2848,5790,4444,[],[]
getting control rt man pays 137 ticket fine w/ 1 bills folded origami ,2012-09-14,21:07:55,1482,3646,4445,[],['nydailynews']
girl rt mia moretti x pencey ss 2013 ,2012-09-13,11:20:27,928,1644,4446,[],['miamoretti']
thoughts exactly rt new iphone double spork gon na freak ,2012-09-12,17:57:35,1388,2728,4447,[],['shannonwoodward']
reunited feels good ,2012-09-11,01:10:42,4011,4421,4448,[],[]
sendin s.o.s ,2012-09-09,15:56:49,2401,4976,4449,[],[]
headed baby shower today ca wait play baby poop melted snickers *pops yaz* ,2012-09-08,14:36:21,3345,4315,4450,[],[]
earthquake ,2012-09-07,16:43:29,2004,3520,4451,['latetweet'],[]
best art direction moon man hipster cool yay ,2012-09-06,21:43:51,3094,5442,4452,"['everyoneinsilverlakewildnout', 'peopleinsilverlakewouldntsaywildnout']",[]
mrs. robinson rt looks like official ,2012-09-06,21:41:31,38180,59237,4453,[],"['NiallOfficial', 'katyperry']"
better preach ,2012-09-06,21:38:03,328,492,4454,[],['RonanFarrow']
yes ,2012-09-06,21:08:00,7909,10438,4455,['forward'],[]
oh rumor *steps down* ,2012-09-06,16:31:42,5968,10151,4456,[],[]
one direction perform vma gon na jump ledge ,2012-09-06,16:18:36,77768,126313,4457,[],[]
girl hope win rt excited ,2012-09-06,11:48:10,1119,2096,4458,['VMAs'],['MDMOLINARI']
success much money make difference make people lives ,2012-09-06,02:07:15,15642,35761,4459,[],[]
haaa rt got 6am today yoga protein shake ran six miles decided lie everything ,2012-09-03,13:59:08,1669,2844,4460,[],['brettgrace']
rt let raaaage ,2012-09-02,23:40:01,2633,5779,4461,[],"['MileyCyrus', 'katyperry']"
one thing certain bbqs tomorrow ,2012-09-02,22:57:57,2040,4350,4462,[],[]
countdown begins 17 days till part ,2012-09-01,14:10:12,1805,3481,4463,[],[]
got claws trixxxed tonight kawaii ,2012-09-01,00:43:57,6827,5330,4464,[],['esNAIL_LA']
nirvanaland jose rodolfo loaiza ontiveros love ,2012-08-31,19:52:06,3127,3388,4465,[],[]
hey spoil dinner young man rt 7/11 sells sushi think agree good thing ,2012-08-30,20:01:11,908,1619,4466,[],['RonanFarrow']
hungry rt girls tryna catch man ,2012-08-28,23:10:42,967,1773,4467,[],"['TheDoctorLuke', 'katyperry', 'shannonwoodward']"
ermahgerd cooking class accompanied wingwomanwoman tonight tackle steak au poive fancy steak ,2012-08-28,21:01:52,1257,1964,4468,[],['shannonwoodward']
comes blu-ray/dvd 9/18 pre-order itunes amazon target go pick blu-ray signed ,2012-08-28,14:33:11,1878,3918,4469,['PartOfMe'],[]
announcement ,2012-08-28,14:32:08,1498,2562,4470,[],[]
little birdie dropped today coincidences god way staying anonymous sneaky ,2012-08-27,19:12:42,3359,6839,4471,[],[]
yes dine walt ,2012-08-26,00:46:47,5492,5280,4472,[],[]
today promised happiness let ,2012-08-25,16:47:34,3492,8553,4473,[],[]
ya damn straight rt sometimes u save lil bit yesterday today rt sleep like geisha ,2012-08-25,13:47:04,852,1556,4474,[],"['shannonwoodward', 'katyperry']"
sleep like geisha ,2012-08-25,03:49:14,1989,3844,4475,[],[]
u could b miner clothes rt dared climb air conditioning ,2012-08-24,20:11:46,955,1551,4476,[],"['shannonwoodward', 'whoisgreggarcia']"
tgif full effect tonight w/my stylist bff mega hunk tune cw 8pm est america next top model premiere ,2012-08-24,15:40:48,1140,2180,4477,[],['johnnywujek']
wake 6 hours vote crust eyes start clicking ,2012-08-24,10:01:06,1044,2329,4478,"['VMAs', 'WideAwake', 'PartOfMe']",[]
truffled chicken bed grilled vegetables hate player hate game ,2012-08-24,00:08:06,2626,2663,4479,[],[]
cooking class tres knife skills tonight dr. standby please ,2012-08-23,21:11:52,1484,2404,4480,[],[]
jealous honey look good rt santa barbara ,2012-08-23,19:09:17,1014,1908,4481,[],"['miamoretti', 'katyperry']"
satellite guster never gets old ,2012-08-23,18:36:54,1326,2654,4482,[],[]
also drum roll please chile germany singapore headed way today going  ,2012-08-23,13:44:44,1025,2347,4483,"['KP3D', 'letsgotothemovies']",[]
might made successful trio breakfast omelets turn scrambles ,2012-08-23,13:15:15,1215,1944,4484,"['lilsuzyhomemaker', 'theresstillhope']",[]
seen making-of yet still catch mtv hits tonight 10p et palladia week ,2012-08-22,15:52:30,1110,2290,4485,['WIDEAWAKE'],[]
2nd night cooking classes time accompanied mise en place ,2012-08-21,20:55:09,1072,1941,4486,[],['shannonwoodward']
remember also vote best female video ,2012-08-21,14:15:27,883,2332,4487,"['PARTOFME', 'VMA']",[]
yo tune mtv hits palladia tomorrow making forget 2 vote 4 wide awake ,2012-08-21,14:15:04,790,1958,4488,"['WIDEAWAKE', 'VMA']",[]
woman play words ,2012-08-21,13:58:03,345,643,4489,[],['shannonwoodward']
tavisty rt report mamma mia still netflix instant ,2012-08-21,13:38:58,643,1222,4490,[],['tavitulle']
help gangnam style k hole ,2012-08-21,03:19:56,3406,10314,4491,[],[]
starting first cooking class oh god learning human ,2012-08-20,20:53:29,5464,7545,4492,[],[]
ca believe broke cat rt like ever cc ,2012-08-18,23:20:19,3363,5307,4493,[],"['shannonwoodward', 'katyperry']"
yeah rt play drake ,2012-08-18,18:56:39,816,1646,4494,[],['yungskeeter']
ovaries brovaries ,2012-08-18,02:32:51,7150,7015,4495,[],[]
ay caramba opens theaters argentina colombia mexico today going weekend ,2012-08-17,19:54:43,2585,5917,4496,['KP3D'],[]
esquivel perfect soundtrack beach-side-bike-ride today ,2012-08-16,22:37:04,1114,2221,4497,[],[]
song week nathanial castro nintendo song solve case pull masks cook scooby snacks ,2012-08-16,15:08:51,849,1622,4498,[],[]
dj crunch wrap supreme rt 500 worth taco bell jealous u bruh bruh ,2012-08-16,03:26:40,985,1505,4499,[],"['yungskeeter', 'katyperry']"
rt feel 'butterflies stomach eating caterpillars ,2012-08-15,22:28:55,1495,3780,4500,[],['FREE_FACTS']
oh heart ,2012-08-14,02:39:45,6393,16899,4501,[],[]
let fair really think deserve season pass ass oh flip flops ,2012-08-13,16:03:41,3532,6730,4502,[],[]
dear 20 sparkler bottle bro club still sleep ,2012-08-11,01:07:28,1980,3555,4503,[],[]
rt ashamed still use 411 ,2012-08-10,22:18:53,1258,3607,4504,[],[]
let make official rt believe posting hit send hitting send ,2012-08-07,02:17:25,1236,1910,4505,[],['greg_wells']
think ri video year found love level ,2012-08-04,02:06:50,3180,7895,4506,['realness'],[]
meditation new xanax ,2012-08-03,19:15:48,2322,5706,4507,[],[]
love ,2012-08-02,17:54:58,324,683,4508,[],['ChrisAnokute']
caipirinha treehouse ,2012-07-31,12:35:43,3136,7965,4509,['lovelyday'],[]
hear last night might spare passes premiere tonight dedicated ,2012-07-30,12:22:59,3036,6511,4510,['KP3DINBRAZIL'],[]
happy back brazil ,2012-07-29,15:11:31,9241,24572,4511,[],[]
woke cat nap sound hundreds brazilian katycats outside hotel room chanting katy eu te amo ,2012-07-29,15:10:37,8051,16314,4512,[],[]
rt wear dress much starting fall apart good luck/show day dress ,2012-07-28,18:32:04,1581,2057,4513,[],['AZEALIABANKS']
favorite summer shoes ,2012-07-28,14:20:14,4713,4601,4514,[],[]
wait exception something throw around like u rt smiley faces r really nothin brah ,2012-07-28,00:01:48,1129,2172,4515,[],['frank_ocean']
ricky lucy totally love separate beds ,2012-07-27,23:52:23,315,612,4516,[],['mdmolinari']
hunty let kiki ,2012-07-27,19:02:57,996,1934,4517,[],[]
someone please pull plug internet really better us humans ,2012-07-26,20:36:17,3222,6826,4518,"['writealetter', 'whoactuallytalks', 'thistweetishypocritical']",[]
brazil u 4 needed u bringing join premiere rio eu te amo ,2012-07-26,16:31:51,4227,10050,4519,['KP3D'],[]
find brad kush ,2012-07-26,13:41:33,858,1783,4520,[],[]
yesss rt reason blare hip-hop suv b/c never heard carole king tapestry ,2012-07-25,02:24:47,762,1292,4521,[],['SarahKSilverman']
best tweet night rt hear mercury retrograde ur always retrograde ur wack ca u consistent ,2012-07-24,01:34:01,930,1746,4522,[],['onlyLeah']
always love seeing one single piece confetti fall indie show ,2012-07-23,23:57:57,2032,3748,4523,[],[]
yo teens thanks making choice summer movie teen choice awards last night makes guys ,2012-07-23,17:37:48,2925,4778,4524,['KP3D'],[]
weird rting rt rt think cat whisperer ,2012-07-22,15:42:10,3307,6726,4525,[],['katyperry']
rt think cat whisperer ,2012-07-22,15:38:22,2183,13262,4526,[],[]
guy wasted //twitpic.com/aaejkm ,2012-07-22,01:57:53,4943,5393,4527,['spooningsoonhttp'],[]
marry rt fanning fire alarm mean ca cook ,2012-07-22,01:18:42,1220,2105,4528,[],['AZEALIABANKS']
give piece ass chance ,2012-07-21,23:45:38,3164,8119,4529,[],[]
judge judy rt loving mcdonald right ,2012-07-20,17:57:39,922,1650,4530,['judgeme'],['AZEALIABANKS']
rt love waking sound construction ,2012-07-19,18:13:29,1803,6462,4531,[],[]
rt friend alter ego ,2012-07-19,12:38:05,382,818,4532,[],"['shannonwoodward', 'ILLUMlNATI']"
twisted rt bought mad katy perry eyelashes cvs yesterday ,2012-07-19,02:29:25,874,1500,4533,[],['AZEALIABANKS']
ever like water chestnuts needs ,2012-07-17,19:54:49,2419,5328,4534,[],[]
want tombstone read best napper time ,2012-07-17,19:26:35,3496,8582,4535,[],[]
treasure chest incredible experience ,2012-07-17,17:56:27,222,459,4536,[],['PerezHilton']
new plates yesssss ,2012-07-17,12:11:48,3741,3991,4537,[],[]
babysitters club bff circa 1994 rt couples skate ,2012-07-16,19:29:54,1072,1459,4538,[],['shannonwoodward']
memories priceless ,2012-07-16,16:25:52,7249,21923,4539,[],[]
nothing manages influence work art less critical words letters young poet ,2012-07-16,12:29:52,1213,2654,4540,[],[]
best guitarist west rt omg bday ,2012-07-16,02:05:55,888,1326,4541,[],"['yungskeeter', 'CaseyHoops']"
la face oakland booty ,2012-07-16,00:53:52,2023,4323,4542,[],[]
caught rt despite well hardcore scene secret love albums ,2012-07-14,16:36:40,716,1263,4543,[],"['imfransexy', 'katyperry']"
rt dont care ur young elvis endless pizza u golden girls wont marry u cat response ,2012-07-14,13:50:59,824,1422,4544,[],['shannonwoodward']
bringing beanie babies back ,2012-07-14,13:47:35,2569,4894,4545,[],[]
amazing rt posted photo ,2012-07-14,04:27:23,1565,2671,4546,[],['amediumformat']
song day kindness house ca give need give feel hot ,2012-07-12,20:33:33,994,1809,4547,[],[]
excited meet take pictures w/all katycats tuna catnip toys w/bells dvd garfield tom n jerry welcome ,2012-07-12,19:10:36,920,1978,4548,['KP3D'],[]
come meet kitty b arclight hwood 2morrow 5-8 arclight sherman oaks sat 5-8 pacific-americana sun 12-3pic.twitter.com/hygjt9ja ,2012-07-12,19:06:46,2299,2465,4549,[],[]
grandma win gma stylin w/her buds movie last night //twitpic.com/a6l7wc ,2012-07-11,19:23:38,3943,3867,4550,"['scenestealer', 'KP3Dhttp']",[]
think daisies friendliest flower ,2012-07-11,03:40:07,3307,6947,4551,[],[]
bought new records marina diamonds electra heart jjamz suicide pact ears tickled joy week ,2012-07-10,22:09:08,1868,2764,4552,[],[]
informed grandma took whole theater vegas 65 friends lolita glasses ,2012-07-10,20:34:22,1746,2311,4553,['KP3D'],[]
hey see concert footage yet check picture see tag ,2012-07-10,17:47:31,703,1297,4554,['KP3D'],[]
far personal favorite song check ,2012-07-10,16:34:33,759,1395,4555,['HUDSONdirtyfaceEP'],[]
like keep family check brother hudson free 3 song ep click like button ,2012-07-10,16:31:01,874,1386,4556,[],[]
rt saw thought movie amazing plus person stood sang danced songs ,2012-07-09,22:10:11,638,1083,4557,"['realman', 'KP3D']",['BrandanEaves']
come rt wants go see 3d 3rd time true friends ,2012-07-09,22:08:30,769,1163,4558,[],"['lovinnuggets', 'katyperry']"
far back remember say cheese right photo idea french state wisconsin ,2012-07-09,21:33:02,976,1809,4559,[],['shannonwoodward']
rt still think sharks come drain pool night ,2012-07-09,18:44:56,2352,11857,4560,[],[]
love song/video kacey musgraves great chorus ,2012-07-09,14:20:43,949,1427,4561,[],[]
lunch break ,2012-07-09,13:55:29,906,1675,4562,[],[]
great idea rt cats coffee place movie genius open one la ,2012-07-09,13:54:00,483,822,4563,['catladies'],"['meggsterhopkins', 'katyperry']"
says thank rt grandmother dead ringer angela landsbury ,2012-07-09,13:52:08,379,647,4564,[],"['LDickholtz', 'katyperry']"
u rt brazil shouts katy eu te amo ,2012-07-09,13:47:59,1236,2332,4565,[],"['brunocohen10', 'katyperry']"
tell rt fav part grandma said u ur sis turned okay far knew ,2012-07-09,13:47:25,436,686,4566,[],"['cristy_nambo', 'katyperry']"
u see dr. rt made want cartwheels cumulonimbus cloud drink 64 oz glitter ,2012-07-09,13:45:27,508,748,4567,[],"['meredithkw', 'katyperry']"
convulsions rt full body shake peacock werld ,2012-07-09,13:43:25,450,768,4568,['KP3D'],"['OliviaRheya', 'katyperry']"
wish rt another fav 'i got ass like nicki minaj hah best humour made laugh ,2012-07-09,13:42:25,593,945,4569,['KP3D'],"['laurasambrook', 'katyperry']"
fake farts rt part w/the fart machine made howl hysterics got strange looks epic ,2012-07-09,13:40:14,466,705,4570,[],['WeGotThePeat']
mom rt saw ur parents got picture w/them afterwards pic.twitter.com/wqatmsqo ,2012-07-09,13:38:29,867,1094,4571,['KP3D'],"['hellofionaleahy', 'katyperry']"
upon rewatching royal tenenbaums decided margot ,2012-07-09,13:32:05,178,241,4572,[],['tavitulle']
u saw wknd write review/tell ur fav part less 140 characters throughout day rt amusing ones ,2012-07-09,13:24:39,715,1231,4573,['KP3D'],[]
hot date rt saturday night movie date niece see movie ,2012-07-07,19:10:43,730,957,4574,['KP3D'],"['CincyReds011', 'katyperry']"
erm rt rt day 7 garden < 3 lollipop gardens rt ,2012-07-07,19:09:10,727,1075,4575,[],"['jessa1130', 'AMCTheatres', 'KatyPerry']"
surprise looks like u found pink tickets pizza party movie night love keeps coming pic.twitter.com/amewkyio ,2012-07-07,15:58:34,1622,1612,4576,['KP3D'],[]
thanks rt go c katy perry theatres b back crying baby jkpic.twitter.com/psam2ytd ,2012-07-07,01:05:05,863,1316,4577,['PartofMe'],['JacksonRathbone']
glad 1st rt first 3d movie loved pic.twitter.com/drys7wqp ,2012-07-07,00:55:36,461,718,4578,['KP3D'],"['19SaMmY_sAm87', 'katyperry']"
spitting image rt kp3d vancouver.pic.twitter.com/drp4zweb ,2012-07-07,00:55:09,497,720,4579,[],"['nikilaa', 'katyperry', 'kphizzle']"
yes hooters shirt rt movie terrific amazing beautiful like youpic.twitter.com/u4i4wxig ,2012-07-06,23:30:22,588,833,4580,[],['amanzo828']
rollin deep rt glasses heart throbbin ground shaking show stopping amazing pic.twitter.com/qqco7ioa ,2012-07-06,23:25:00,453,676,4581,['KP3D'],"['R_Moya8', 'katyperry']"
meow rt kitty claws ..and course pic.twitter.com/vt2mhlpm ,2012-07-06,23:20:13,524,804,4582,['KP3Dglasses'],"['katyyperryyoxo', 'katyperry']"
r ur mothers rt hey look outfits yolopic.twitter.com/0sodwzmf ,2012-07-06,23:14:24,933,1432,4583,['KP3D'],"['eurareynolds1', 'katyperry', 'BrittanyLynne1']"
um keep precious rt glasses pic.twitter.com/mkj7yq3k ,2012-07-06,23:13:04,648,828,4584,['KP3D'],"['KatysBlueEyes', 'katyperry']"
yes four eyes rt im creative .twitter.com/ehc9hpcz ,2012-07-06,23:12:20,392,620,4585,['KP3Dpic'],"['kperryshusband', 'katyperry']"
sister rt sister sneak peek pic.twitter.com/n1ujzp79 ,2012-07-06,23:11:22,447,683,4586,['KP3D'],"['CrystalMerrill', 'katyperry', 'kellmerr23']"
rawk rt absolutely loved katy perry part movie ,2012-07-06,23:09:52,377,601,4587,['KP3D'],"['BethanyMulanax', 'katyperry']"
dedicated rt sleeping shades ,2012-07-06,23:09:08,391,572,4588,['KP3D'],"['TXBieberNavy', 'katyperry']"
hey thanks rt absolutely loved 3d pic.twitter.com/rzrh3sok ,2012-07-06,23:05:35,424,699,4589,['PartOfMeMovie'],"['tcabe0823', 'katyperry']"
adorbie rt say best movie world good .twitter.com/tekb9tao ,2012-07-06,22:58:13,387,628,4590,"['KP3D', 'ilovetheglassespic']",['InspireSwifty']
gogogo rt getting ready see katy perry part ,2012-07-06,22:50:49,389,579,4591,['BondingTime'],"['Maria_Manning', 'katyperry']"
twerk duck lips rt set ready see fireworks .twitter.com/kbai1zny ,2012-07-06,22:34:08,427,691,4592,['KP3Dpic'],"['SeanInTheCity', 'katyperry']"
go tabby rt hope u see collage made theaters watching moviepic.twitter.com/6nx0ftqp ,2012-07-06,22:32:22,424,676,4593,[],"['KatyCatobsessed', 'katyperry']"
rt ppl glasses looking creative pix ,2012-07-06,22:23:53,584,1174,4594,['KP3D'],[]
